{
  "$schema": "https://json-schema.org/draft/2020-12/schema",
  "$id": "heroes-reforged/ability.schema.json",
  "title": "Ability",
  "type": "object",
  "required": [
    "schemaVersion",
    "id",
    "name",
    "effects"
  ],
  "properties": {
    "schemaVersion": { "type": "integer", "minimum": 1 },
    "id":            { "type": "string", "minLength": 1 },
    "name":          { "type": "string", "minLength": 1 },
    "description":   { "type": "string" },
    "tags": {
      "type": "array",
      "items": { "type": "string", "minLength": 1 }
    },
    "effects": {
      "type": "array",
      "minItems": 1,
      "items": { "$ref": "heroes-reforged/effect.schema.json" }
    }
  },
  "additionalProperties": false
}
