{
  "$schema": "heroes-reforged/ability.schema.json",
  "schemaVersion": 1,
  "id": "shared:ability:undead",
  "name": "Undead",
  "description": "Immune to morale rolls and to mind-affecting status effects.",
  "tags": ["combat", "passive", "immunity", "creature_type"],
  "effects": [
    {
      "kind": "modify_stat",
      "target": "self",
      "stat": "morale",
      "value": 0
    }
  ]
}
